{
  "@context": "https://obligationfirst.org/v1/context.jsonld",
  "@type": "of:Instrument",
  "@id": "https://obligationfirst.org/v1/examples/colorado-sb24-205/instrument/sb26-189",
  "title": "SB26-189 Automated Decision-Making Technology",
  "issuedBy": "https://obligationfirst.org/v1/examples/colorado-sb24-205/authority/general-assembly",
  "kind": "statute",
  "status": "enacted",
  "supersedes": [
    "https://obligationfirst.org/v1/examples/colorado-sb24-205/instrument/sb24-205"
  ],
  "jurisdiction": {
    "@type": "of:Jurisdiction",
    "territorial_scope": [
      "us-co"
    ]
  },
  "source": "https://leg.colorado.gov/bills/sb26-189",
  "sameAs": [
    "https://everyailaw.com/instrument/colorado-sb26-189.json"
  ]
}
